{"allowed_executables":[{"executable_identifier":"otool","sha256":"65e37c1272168e1dcfc98cc62130ea31b0dbc44706a671954c1714871aabe860"},{"executable_identifier":"python","sha256":"695fc18cdb9a699c6b1ea88ce4027854782ed704eb34cc3200e6f8380155b6a8"},{"executable_identifier":"sandbox-exec","sha256":"1ee5929deadec7bceb3dd27f7b975917d782a5f160315b42e6e3f6d25d561d41"},{"executable_identifier":"sw-vers","sha256":"7dd0c88f3de02610f737792161d7958a6618063a4960c13bfe6c310a75263a28"}],"dependency_lock":{"closed_environment_identity":"85949c1aab8050a935895b907441cbba1b7f696f91ee89ad780b43a079617c0a","format":"pep751-pylock-v1","git_blob_binding":"exact_blob_at_source_commit","lock_identity":"c49863049ed25585b3c06cdc87c88bfe54b8d839cf2b8f41814cd52546b5284d","offline_artifact_manifest":{"identity":"17623406a04ae36938e56480d6cce8257c0ce5e2d5cd410b5136eff40433525c","path":"config/research/readiness/offline-artifact-manifest-v1.json","sha256":"6c02495dc8164b55a8c6aab8bcd4f34d8853489323b435b1807048beace2eafc"},"path":"requirements/pylock.readiness-v1.toml","sha256":"11afcc39df18db5b1d90fb7355decb0d4c96a02ee602f3cdce9b23b0d6682258"},"environment":{"bytecode_policy":"disabled","cwd_policy":"detached_source_root","hash_seed":"0","locale":"C","network_policy":"prohibited","pytest_plugin_autoload":"disabled","python_utf8":"1","pythonpath_policy":"prohibited","timezone":"UTC","user_site_policy":"disabled"},"host_system":{"architecture":"arm64","darwin_release":"24.0.0","dynamic_links":[{"compatibility_version":"1.0.0","consumer":"dependency/numpy/_core/_multiarray_tests.cpython-314-darwin.so","current_version":"1345.120.2","install_name":"/usr/lib/libSystem.B.dylib","resolved_sha256":""},{"compatibility_version":"1.0.0","consumer":"dependency/numpy/_core/_multiarray_umath.cpython-314-darwin.so","current_version":"4.0.0","install_name":"/System/Library/Frameworks/Accelerate.framework/Versions/A/Accelerate","resolved_sha256":""},{"compatibility_version":"1.0.0","consumer":"dependency/numpy/_core/_multiarray_umath.cpython-314-darwin.so","current_version":"1345.120.2","install_name":"/usr/lib/libSystem.B.dylib","resolved_sha256":""},{"compatibility_version":"1.0.0","consumer":"dependency/numpy/_core/_multiarray_umath.cpython-314-darwin.so","current_version":"1700.255.5","install_name":"/usr/lib/libc++.1.dylib","resolved_sha256":""},{"compatibility_version":"1.0.0","consumer":"dependency/numpy/_core/_operand_flag_tests.cpython-314-darwin.so","current_version":"1345.120.2","install_name":"/usr/lib/libSystem.B.dylib","resolved_sha256":""},{"compatibility_version":"1.0.0","consumer":"dependency/numpy/_core/_rational_tests.cpython-314-darwin.so","current_version":"1345.120.2","install_name":"/usr/lib/libSystem.B.dylib","resolved_sha256":""},{"compatibility_version":"1.0.0","consumer":"dependency/numpy/_core/_simd.cpython-314-darwin.so","current_version":"1345.120.2","install_name":"/usr/lib/libSystem.B.dylib","resolved_sha256":""},{"compatibility_version":"1.0.0","consumer":"dependency/numpy/_core/_struct_ufunc_tests.cpython-314-darwin.so","current_version":"1345.120.2","install_name":"/usr/lib/libSystem.B.dylib","resolved_sha256":""},{"compatibility_version":"1.0.0","consumer":"dependency/numpy/_core/_umath_tests.cpython-314-darwin.so","current_version":"1345.120.2","install_name":"/usr/lib/libSystem.B.dylib","resolved_sha256":""},{"compatibility_version":"1.0.0","consumer":"dependency/numpy/fft/_pocketfft_umath.cpython-314-darwin.so","current_version":"1345.120.2","install_name":"/usr/lib/libSystem.B.dylib","resolved_sha256":""},{"compatibility_version":"1.0.0","consumer":"dependency/numpy/fft/_pocketfft_umath.cpython-314-darwin.so","current_version":"1700.255.5","install_name":"/usr/lib/libc++.1.dylib","resolved_sha256":""},{"compatibility_version":"1.0.0","consumer":"dependency/numpy/linalg/_umath_linalg.cpython-314-darwin.so","current_version":"4.0.0","install_name":"/System/Library/Frameworks/Accelerate.framework/Versions/A/Accelerate","resolved_sha256":""},{"compatibility_version":"1.0.0","consumer":"dependency/numpy/linalg/_umath_linalg.cpython-314-darwin.so","current_version":"1345.120.2","install_name":"/usr/lib/libSystem.B.dylib","resolved_sha256":""},{"compatibility_version":"1.0.0","consumer":"dependency/numpy/linalg/lapack_lite.cpython-314-darwin.so","current_version":"4.0.0","install_name":"/System/Library/Frameworks/Accelerate.framework/Versions/A/Accelerate","resolved_sha256":""},{"compatibility_version":"1.0.0","consumer":"dependency/numpy/linalg/lapack_lite.cpython-314-darwin.so","current_version":"1345.120.2","install_name":"/usr/lib/libSystem.B.dylib","resolved_sha256":""},{"compatibility_version":"1.0.0","consumer":"dependency/numpy/random/_bounded_integers.cpython-314-darwin.so","current_version":"1345.120.2","install_name":"/usr/lib/libSystem.B.dylib","resolved_sha256":""},{"compatibility_version":"1.0.0","consumer":"dependency/numpy/random/_common.cpython-314-darwin.so","current_version":"1345.120.2","install_name":"/usr/lib/libSystem.B.dylib","resolved_sha256":""},{"compatibility_version":"1.0.0","consumer":"dependency/numpy/random/_generator.cpython-314-darwin.so","current_version":"1345.120.2","install_name":"/usr/lib/libSystem.B.dylib","resolved_sha256":""},{"compatibility_version":"1.0.0","consumer":"dependency/numpy/random/_mt19937.cpython-314-darwin.so","current_version":"1345.120.2","install_name":"/usr/lib/libSystem.B.dylib","resolved_sha256":""},{"compatibility_version":"1.0.0","consumer":"dependency/numpy/random/_pcg64.cpython-314-darwin.so","current_version":"1345.120.2","install_name":"/usr/lib/libSystem.B.dylib","resolved_sha256":""},{"compatibility_version":"1.0.0","consumer":"dependency/numpy/random/_philox.cpython-314-darwin.so","current_version":"1345.120.2","install_name":"/usr/lib/libSystem.B.dylib","resolved_sha256":""},{"compatibility_version":"1.0.0","consumer":"dependency/numpy/random/_sfc64.cpython-314-darwin.so","current_version":"1345.120.2","install_name":"/usr/lib/libSystem.B.dylib","resolved_sha256":""},{"compatibility_version":"1.0.0","consumer":"dependency/numpy/random/bit_generator.cpython-314-darwin.so","current_version":"1345.120.2","install_name":"/usr/lib/libSystem.B.dylib","resolved_sha256":""},{"compatibility_version":"1.0.0","consumer":"dependency/numpy/random/mtrand.cpython-314-darwin.so","current_version":"1345.120.2","install_name":"/usr/lib/libSystem.B.dylib","resolved_sha256":""},{"compatibility_version":"1.0.0","consumer":"dependency/pandas/_libs/_cyutility.cpython-314-darwin.so","current_version":"1351.0.0","install_name":"/usr/lib/libSystem.B.dylib","resolved_sha256":""},{"compatibility_version":"1.0.0","consumer":"dependency/pandas/_libs/algos.cpython-314-darwin.so","current_version":"1351.0.0","install_name":"/usr/lib/libSystem.B.dylib","resolved_sha256":""},{"compatibility_version":"1.0.0","consumer":"dependency/pandas/_libs/arrays.cpython-314-darwin.so","current_version":"1351.0.0","install_name":"/usr/lib/libSystem.B.dylib","resolved_sha256":""},{"compatibility_version":"1.0.0","consumer":"dependency/pandas/_libs/byteswap.cpython-314-darwin.so","current_version":"1351.0.0","install_name":"/usr/lib/libSystem.B.dylib","resolved_sha256":""},{"compatibility_version":"1.0.0","consumer":"dependency/pandas/_libs/groupby.cpython-314-darwin.so","current_version":"1351.0.0","install_name":"/usr/lib/libSystem.B.dylib","resolved_sha256":""},{"compatibility_version":"1.0.0","consumer":"dependency/pandas/_libs/hashing.cpython-314-darwin.so","current_version":"1351.0.0","install_name":"/usr/lib/libSystem.B.dylib","resolved_sha256":""},{"compatibility_version":"1.0.0","consumer":"dependency/pandas/_libs/hashtable.cpython-314-darwin.so","current_version":"1351.0.0","install_name":"/usr/lib/libSystem.B.dylib","resolved_sha256":""},{"compatibility_version":"1.0.0","consumer":"dependency/pandas/_libs/index.cpython-314-darwin.so","current_version":"1351.0.0","install_name":"/usr/lib/libSystem.B.dylib","resolved_sha256":""},{"compatibility_version":"1.0.0","consumer":"dependency/pandas/_libs/indexing.cpython-314-darwin.so","current_version":"1351.0.0","install_name":"/usr/lib/libSystem.B.dylib","resolved_sha256":""},{"compatibility_version":"1.0.0","consumer":"dependency/pandas/_libs/internals.cpython-314-darwin.so","current_version":"1351.0.0","install_name":"/usr/lib/libSystem.B.dylib","resolved_sha256":""},{"compatibility_version":"1.0.0","consumer":"dependency/pandas/_libs/interval.cpython-314-darwin.so","current_version":"1351.0.0","install_name":"/usr/lib/libSystem.B.dylib","resolved_sha256":""},{"compatibility_version":"1.0.0","consumer":"dependency/pandas/_libs/join.cpython-314-darwin.so","current_version":"1351.0.0","install_name":"/usr/lib/libSystem.B.dylib","resolved_sha256":""},{"compatibility_version":"1.0.0","consumer":"dependency/pandas/_libs/json.cpython-314-darwin.so","current_version":"1351.0.0","install_name":"/usr/lib/libSystem.B.dylib","resolved_sha256":""},{"compatibility_version":"1.0.0","consumer":"dependency/pandas/_libs/lib.cpython-314-darwin.so","current_version":"1351.0.0","install_name":"/usr/lib/libSystem.B.dylib","resolved_sha256":""},{"compatibility_version":"1.0.0","consumer":"dependency/pandas/_libs/missing.cpython-314-darwin.so","current_version":"1351.0.0","install_name":"/usr/lib/libSystem.B.dylib","resolved_sha256":""},{"compatibility_version":"1.0.0","consumer":"dependency/pandas/_libs/ops.cpython-314-darwin.so","current_version":"1351.0.0","install_name":"/usr/lib/libSystem.B.dylib","resolved_sha256":""},{"compatibility_version":"1.0.0","consumer":"dependency/pandas/_libs/ops_dispatch.cpython-314-darwin.so","current_version":"1351.0.0","install_name":"/usr/lib/libSystem.B.dylib","resolved_sha256":""},{"compatibility_version":"1.0.0","consumer":"dependency/pandas/_libs/pandas_datetime.cpython-314-darwin.so","current_version":"1351.0.0","install_name":"/usr/lib/libSystem.B.dylib","resolved_sha256":""},{"compatibility_version":"1.0.0","consumer":"depende